{
  "schema_version": 1,
  "artifact": "review",
  "iteration": 2,
  "edl_revision": 2,
  "status": "approved",
  "checklist": {
    "brief": true,
    "beats": true,
    "retakes": true,
    "redundancy": true,
    "continuity": true,
    "evidence": true,
    "pacing": true,
    "justifications": true
  },
  "findings": [],
  "summary": "A montagem cumpre o brief, usa o retake correto e termina com uma ação clara.",
  "revised_edl": null
}
